{
  "schemaVersion": 1,
  "paletteVersion": "1.1.0",
  "package": {
    "name": "@kaspersky/hexa-ui",
    "versionRange": "^6.387.4"
  },
  "categoryOrder": [
    "Поля ввода",
    "Действия",
    "Контейнеры",
    "Отображение",
    "Обратная связь"
  ],
  "components": [
    {
      "type": "Textbox",
      "icon": "Text",
      "exportName": "Textbox",
      "exportPath": "input",
      "propsType": "TextboxProps",
      "propsTypePath": "input",
      "title": "Текстовое поле",
      "description": "Однострочное текстовое поле",
      "keywords": ["input", "text", "textbox", "строка"],
      "category": "Поля ввода",
      "order": 10,
      "status": "stable",
      "acceptsChildren": false,
      "defaultProps": {},
      "defaultMeta": { "buildType": "any" },
      "preview": { "valueProp": "value" },
      "meta": { "entity": "text" }
    },
    {
      "type": "Checkbox",
      "icon": "CheckedSquare",
      "exportName": "Checkbox",
      "exportPath": "checkbox",
      "propsType": "CheckboxProps",
      "propsTypePath": "checkbox",
      "title": "Чекбокс",
      "description": "Логический переключатель",
      "keywords": ["checkbox", "boolean", "флаг"],
      "category": "Поля ввода",
      "order": 20,
      "status": "stable",
      "acceptsChildren": false,
      "defaultProps": {},
      "defaultMeta": { "buildType": "any" },
      "preview": { "labelProp": "children", "valueProp": "checked" },
      "props": {
        "include": ["children", "checked", "defaultChecked", "required", "mode", "theme"],
        "overrides": {
          "children": { "editor": "text", "title": "Текст" }
        }
      },
      "meta": { "entity": "checkbox" }
    },
    {
      "type": "CheckboxGroup",
      "icon": "CheckedSquare",
      "exportName": "CheckboxGroup",
      "exportPath": "checkbox",
      "propsType": "CheckboxGroupProps",
      "propsTypePath": "checkbox",
      "title": "Группа чекбоксов",
      "description": "Группа логических переключателей",
      "keywords": ["checkbox", "group", "options"],
      "category": "Поля ввода",
      "order": 30,
      "status": "stable",
      "acceptsChildren": false,
      "defaultProps": {},
      "defaultMeta": { "buildType": "any" },
      "props": {
        "include": ["options", "value", "defaultValue", "invalid", "readonly", "mode", "direction", "theme"],
        "overrides": {
          "options": { "editor": "json", "title": "Опции" }
        }
      },
      "meta": { "entity": "checkboxGroup" }
    },
    {
      "type": "Radio",
      "icon": "CheckPoint",
      "exportName": "Radio",
      "exportPath": "radio",
      "propsType": "RadioProps",
      "propsTypePath": "radio",
      "title": "Радиогруппа",
      "description": "Выбор одного значения из списка",
      "keywords": ["radio", "choice", "options"],
      "category": "Поля ввода",
      "order": 40,
      "status": "stable",
      "acceptsChildren": false,
      "defaultProps": {},
      "defaultMeta": { "buildType": "any" },
      "props": {
        "include": ["vertical", "options", "value", "defaultValue", "theme"],
        "overrides": {
          "options": { "editor": "json", "title": "Опции" }
        }
      },
      "meta": { "entity": "radio" }
    },
    {
      "type": "Toggle",
      "icon": "Switch",
      "exportName": "Toggle",
      "exportPath": "toggle",
      "propsType": "ToggleProps",
      "propsTypePath": "toggle",
      "title": "Тоггл",
      "description": "Двухпозиционный переключатель",
      "keywords": ["toggle", "switch", "boolean"],
      "category": "Поля ввода",
      "order": 50,
      "status": "stable",
      "acceptsChildren": false,
      "defaultProps": {},
      "defaultMeta": { "buildType": "any" },
      "preview": { "valueProp": "checked" },
      "meta": { "entity": "toggle" }
    },
    {
      "type": "Select",
      "icon": "List",
      "exportName": "Select",
      "exportPath": "select",
      "propsType": "SelectProps",
      "propsTypePath": "select",
      "title": "Список",
      "description": "Выбор одного или нескольких значений",
      "keywords": ["select", "dropdown", "options", "список"],
      "category": "Поля ввода",
      "order": 60,
      "status": "stable",
      "acceptsChildren": false,
      "defaultProps": {},
      "defaultMeta": { "buildType": "any" },
      "preview": { "valueProp": "value" },
      "props": {
        "exclude": ["renderFooter", "renderHeader", "renderDropdown", "getPopupContainer", "tagRender", "dropdownStyle"],
        "overrides": {
          "options": { "editor": "json", "title": "Опции" },
          "loadingError": { "editor": "text", "title": "Ошибка загрузки" },
          "notFoundContent": { "editor": "text", "title": "Нет данных" },
          "placeholder": { "editor": "text", "title": "Плейсхолдер" }
        }
      },
      "meta": { "entity": "select" }
    },
    {
      "type": "Calendar",
      "icon": "Calendar",
      "exportName": "Calendar",
      "exportPath": "datepicker",
      "propsType": "CalendarProps",
      "propsTypePath": "datepicker",
      "title": "Дата",
      "description": "Выбор даты",
      "keywords": ["date", "calendar", "дата"],
      "category": "Поля ввода",
      "order": 70,
      "status": "stable",
      "acceptsChildren": false,
      "defaultProps": {},
      "defaultMeta": { "buildType": "any" },
      "preview": { "valueProp": "value" },
      "meta": { "entity": "date" }
    },
    {
      "type": "RangePicker",
      "icon": "Calendar",
      "exportName": "RangePicker",
      "exportPath": "datepicker",
      "propsType": "RangePickerProps",
      "propsTypePath": "datepicker",
      "title": "Диапазон дат",
      "description": "Выбор начала и конца периода",
      "keywords": ["date", "range", "calendar", "период"],
      "category": "Поля ввода",
      "order": 80,
      "status": "stable",
      "acceptsChildren": false,
      "defaultProps": {},
      "defaultMeta": { "buildType": "any" },
      "preview": { "valueProp": "value" },
      "meta": { "entity": "dateRange" }
    },
    {
      "type": "Button",
      "icon": "Ok",
      "exportName": "Button",
      "exportPath": "button",
      "propsType": "ButtonProps",
      "propsTypePath": "button",
      "title": "Кнопка",
      "description": "Кнопка действия",
      "keywords": ["button", "action", "кнопка"],
      "category": "Действия",
      "order": 10,
      "status": "stable",
      "acceptsChildren": false,
      "defaultProps": {},
      "defaultMeta": { "buildType": "any" },
      "preview": { "labelProp": "text" },
      "props": {
        "overrides": {
          "iconBefore": { "editor": "iconSelect", "title": "Иконка слева" },
          "iconAfter": { "editor": "iconSelect", "title": "Иконка справа" }
        }
      },
      "meta": { "entity": "button" }
    },
    {
      "type": "Field",
      "icon": "Component",
      "exportName": "Field",
      "exportPath": "field",
      "propsType": "FieldProps",
      "propsTypePath": "field",
      "title": "Поле формы",
      "description": "Контейнер контрола с лейблом и сообщением",
      "keywords": ["field", "label", "container"],
      "category": "Контейнеры",
      "order": 10,
      "status": "stable",
      "acceptsChildren": true,
      "deniedChildren": ["field"],
      "defaultProps": {},
      "defaultMeta": { "buildType": "any" },
      "preview": { "labelProp": "label" },
      "meta": { "entity": "field" }
    },
    {
      "type": "Accordion",
      "icon": "Menu",
      "exportName": "Accordion",
      "exportPath": "accordion",
      "propsType": "AccordionProps",
      "propsTypePath": "accordion",
      "title": "Аккордеон",
      "description": "Контейнер раскрывающихся секций",
      "keywords": ["accordion", "collapse", "container"],
      "category": "Контейнеры",
      "order": 20,
      "status": "stable",
      "acceptsChildren": true,
      "deniedChildren": ["accordion"],
      "defaultProps": {},
      "defaultMeta": { "buildType": "any" },
      "meta": { "entity": "accordion" }
    },
    {
      "type": "AccordionPanel",
      "icon": "Menu2",
      "exportName": "AccordionPanel",
      "exportPath": "accordion",
      "propsType": "AccordionPanelProps",
      "propsTypePath": "accordion",
      "title": "Секция аккордеона",
      "description": "Раскрывающаяся секция",
      "keywords": ["accordion", "panel", "section"],
      "category": "Контейнеры",
      "order": 30,
      "status": "stable",
      "acceptsChildren": true,
      "deniedChildren": ["accordionPanel"],
      "defaultProps": {},
      "defaultMeta": { "buildType": "any" },
      "preview": { "labelProp": "title" },
      "props": {
        "overrides": {
          "title": { "editor": "text", "title": "Заголовок" }
        }
      },
      "meta": { "entity": "accordionPanel" }
    },
    {
      "type": "Grid",
      "icon": "Grid",
      "exportName": "Grid",
      "exportPath": "grid",
      "propsType": "GridProps",
      "propsTypePath": "grid",
      "title": "Сетка",
      "description": "Контейнер сеточного layout",
      "keywords": ["grid", "layout", "container"],
      "category": "Контейнеры",
      "order": 40,
      "status": "stable",
      "acceptsChildren": true,
      "deniedChildren": ["grid"],
      "defaultProps": {},
      "defaultMeta": { "buildType": "any" },
      "meta": { "entity": "grid" }
    },
    {
      "type": "GridItem",
      "icon": "AppsGrid",
      "exportName": "GridItem",
      "exportPath": "grid",
      "propsType": "GridItemProps",
      "propsTypePath": "grid",
      "title": "Ячейка сетки",
      "description": "Элемент Grid",
      "keywords": ["grid", "item", "cell"],
      "category": "Контейнеры",
      "order": 50,
      "status": "stable",
      "acceptsChildren": true,
      "deniedChildren": ["gridItem"],
      "defaultProps": {},
      "defaultMeta": { "buildType": "any" },
      "meta": { "entity": "gridItem" }
    },
    {
      "type": "Space",